{
  "Success": true,
  "Skipped": true,
  "State": "dependency-probe-only",
  "TensorRtLine": 8,
  "ModelSource": "embedded-dynamic-identity",
  "EnginePath": "",
  "Parsed": false,
  "EngineSaved": false,
  "EngineFileRoundTrip": false,
  "DryRun": false,
  "InferenceRan": false,
  "OutputMatch": false,
  "ProfileIndex": -1,
  "ElapsedMilliseconds": null,
  "SkipReason": "TensorRT native build dependency or runtime is unavailable: TensorRT ONNX parser library was not found at build time.",
  "NormalizedCommandLine": "--tensor-rt-line 8 --saveEngine E:\\GitSpace\\TensorRT-CSharp-API-4.0\\TensorRtSharp4.0\\artifacts\\real-case\\trtexec-builder-scalar-trt8-cuda12\\identity.plan --workspace 64 --profilingVerbosity layer_names_only --exportReport E:\\GitSpace\\TensorRT-CSharp-API-4.0\\TensorRtSharp4.0\\artifacts\\real-case\\trtexec-builder-scalar-trt8-cuda12\\trt8-builder-scalar-build-report.json --batch 2 --iterations 10 --warmUp 200 --duration 3 --streams 1 --builderOptimizationLevel 4 --maxNbTactics 32 --tilingOptimizationLevel Moderate --l2LimitForTiling 268435456B --quantizationFlags CalibrateBeforeFusion --buildOnly",
  "NormalizedCommandSha256": "8c4d5c1e44d06a8e1e8420d274d61530c0461a5e6cc74bac8708f08b29825163",
  "DeploymentOptions": {
    "DeviceOrdinal": null,
    "BuilderOptimizationLevel": 4,
    "MaxAuxStreams": null,
    "DlaCore": null,
    "AllowGpuFallback": false,
    "TacticSources": "",
    "MemoryPoolSizes": [],
    "InputIOFormats": "",
    "OutputIOFormats": "",
    "CalibrationCacheFile": "",
    "DirectIO": false,
    "Sparsity": "",
    "StronglyTyped": false,
    "MinTiming": null,
    "AvgTiming": null,
    "PrecisionConstraints": "",
    "LayerPrecisions": "",
    "LayerOutputTypes": "",
    "Fp8": false,
    "Best": false,
    "DumpRefit": false,
    "AllowWeightStreaming": false,
    "MarkDebug": "",
    "DumpDebugTensors": false,
    "VersionCompatible": false,
    "ExcludeLeanRuntime": false,
    "StripWeights": false,
    "Refit": false,
    "WeightStreamingBudgetBytes": null,
    "ExportTimingCachePath": "",
    "Safe": false,
    "Consistency": false,
    "BuilderCache": false,
    "NoBuilderCache": false,
    "MaxNbTactics": 32,
    "TilingOptimizationLevel": 2,
    "L2LimitForTilingBytes": 268435456,
    "QuantizationFlags": 1,
    "ScalarControlSummary": "MaxNbTactics=32;TilingOptimizationLevel=Moderate;L2LimitForTilingBytes=268435456;QuantizationFlags=CalibrateBeforeFusion"
  },
  "RuntimeOptions": {
    "NoDataTransfers": false,
    "UseSpinWait": false,
    "Threads": null,
    "AvgRuns": null,
    "Percentile": null,
    "SleepTimeMilliseconds": null,
    "IdleTimeMilliseconds": null,
    "InfStreams": null,
    "LoadInputs": "",
    "DumpOutput": false,
    "DumpRawBindingsToFile": "",
    "ExportOutputPath": "",
    "ExportTimesPath": "",
    "ExportProfilePath": "",
    "SaveProfilePath": "",
    "HasRuntimeDiagnostics": false
  },
  "PreflightMetadata": {
    "Kind": "",
    "Path": "",
    "Exists": false,
    "LengthBytes": 0,
    "Sha256": "",
    "PreflightState": "",
    "ProofClassification": "",
    "EvidenceBoundary": ""
  },
  "LoadedEngineDiagnostics": {
    "Attempted": false,
    "Succeeded": false,
    "DiagnosticsState": "",
    "FailureReason": "",
    "EngineName": "",
    "IOTensorCount": 0,
    "LayerCount": 0,
    "OptimizationProfileCount": 0,
    "DeviceMemorySizeInBytes": 0,
    "AuxiliaryStreamCount": 0,
    "Capability": "",
    "ProfilingVerbosity": "",
    "InspectorInformationLength": 0,
    "IOTensorSummaries": [],
    "ReadbackFingerprint": "",
    "ReadbackSha256": "",
    "EvidenceBoundary": ""
  },
  "TimingCacheArtifact": {
    "InputRequested": false,
    "InputApplied": false,
    "InputPath": "",
    "InputLengthBytes": 0,
    "InputSha256": "",
    "OutputRequested": false,
    "OutputWritten": false,
    "OutputPath": "",
    "OutputLengthBytes": 0,
    "OutputSha256": "",
    "State": "",
    "EvidenceBoundary": "timing-cache import/export evidence is build-cache lifecycle metadata only; no cache was requested."
  },
  "CapabilityProbe": {
    "Attempted": true,
    "ProbeState": "capability-probe-only",
    "TensorRtLine": 8,
    "TensorRtVersion": "8.6.1",
    "CudaToolkitVersion": "12.1",
    "RuntimeAvailable": true,
    "BuilderAvailable": true,
    "BuilderConfigAvailable": true,
    "EngineInspectorApiAvailable": false,
    "Fp8FlagRequested": false,
    "Fp8FlagKnown": false,
    "DebugTensorOptionsRequested": false,
    "DebugTensorApiKnown": false,
    "WeightStreamingRequested": false,
    "WeightStreamingApiKnown": false,
    "ProbeItems": [
      "runtime:create:True",
      "builder:create:True",
      "builder-config:create:True",
      "engine-inspector:managed-api:False",
      "fp8-builder-flag:requested:False:known:False",
      "debug-tensor-options:requested:False:known:False",
      "weight-streaming-options:requested:False:known:False"
    ],
    "EvidenceBoundary": "capability-probe-only records host/tool API availability and requested advanced options; it does not build a proof model, enqueue inference, validate outputs, or promote parse-only options to runtime proof."
  },
  "WorkspaceBytes": 67108864,
  "BuilderConfigDeploymentSnapshot": null,
  "ParserPreflightSnapshot": {
    "Line": 10,
    "ParseAttempted": false,
    "ParseSucceeded": false,
    "DiagnosticsState": "not-attempted",
    "ErrorCount": 0,
    "CopiedDiagnosticCount": 0,
    "DiagnosticSummary": "",
    "IdentityOperatorSupported": false,
    "ModelSupportAttempted": false,
    "ModelSupportState": "not-attempted",
    "ModelSupported": false,
    "SupportedSubgraphCount": 0,
    "UnsupportedSubgraphCount": 0,
    "CopiedSubgraphCount": 0,
    "CopiedSupportedSubgraphCount": 0,
    "CopiedUnsupportedSubgraphCount": 0,
    "CopiedNodeCount": 0,
    "EvidenceKind": "copied-parser-preflight",
    "EvidenceBoundary": "copied parser diagnostics and support counters are build/preflight evidence only; they do not prove real-model-runtime or package-consumer-runtime.",
    "PointerFreeCopiedSnapshot": true,
    "CanPromoteRuntimeProof": false,
    "CanPromoteReleaseProof": false,
    "CanDeleteDeferredRecord": false
  },
  "OptionImplementationStatus": {
    "ParsedOptions": [
      "--tensor-rt-line",
      "--workspace",
      "--profilingVerbosity",
      "--builderOptimizationLevel",
      "--maxNbTactics",
      "--tilingOptimizationLevel",
      "--l2LimitForTiling",
      "--quantizationFlags"
    ],
    "AppliedOptions": [
      "--tensor-rt-line",
      "--workspace",
      "--builderOptimizationLevel",
      "--quantizationFlags"
    ],
    "ParseOnlyOptions": [
      "--maxNbTactics",
      "--tilingOptimizationLevel",
      "--l2LimitForTiling",
      "capability-probe-only"
    ],
    "EvidenceBoundary": "build reports distinguish parsed, applied, parse-only, and capability-probe-only evidence; parse-only/build-only/capability-probe-only evidence cannot promote real-model-runtime or package-consumer-runtime proof; load-engine readonly diagnostics are metadata-only and cannot promote runtime proof."
  },
  "BenchmarkSummary": {
    "TimingSamplesMilliseconds": [],
    "TimingSampleCount": 0,
    "AverageElapsedMilliseconds": null,
    "MinElapsedMilliseconds": null,
    "MaxElapsedMilliseconds": null,
    "AvgRunsRequested": null,
    "AvgRunsExecuted": 0,
    "PercentileRequested": null,
    "PercentileElapsedMilliseconds": null,
    "ThreadsRequested": null,
    "ThreadsExecuted": 0,
    "NoDataTransfersRequested": false,
    "NoDataTransfersApplied": false,
    "UseSpinWaitRequested": false,
    "SleepTimeMillisecondsRequested": null,
    "SleepTimeMillisecondsApplied": 0,
    "IdleTimeMillisecondsRequested": null,
    "IdleTimeMillisecondsApplied": 0,
    "BenchmarkBoundary": "benchmark-skipped; no runtime timing samples were produced."
  },
  "ProofClassification": "dependency-probe-only",
  "EvidenceClassifications": [
    "build-only",
    "dependency-probe-only",
    "precheck",
    "synthetic-input-runtime",
    "real-model-runtime",
    "package-consumer-runtime"
  ],
  "BuildEvidenceOnly": true,
  "IsRealModelRuntimeProof": false,
  "IsPackageConsumerRuntimeProof": false,